{
  "$schema": "http://json-schema.org/draft-07/schema#",
  "$comment": "GENERATED by gui/schema-gen/derive_nf_config_schemas.py from config/li-admf.json + its source (ADR-0425). Do not edit; regenerate.",
  "title": "li-admf",
  "type": "object",
  "additionalProperties": false,
  "properties": {
    "hi1_port": {
      "type": "integer",
      "x-env-override": "LI_ADMF_HI1_PORT",
      "x-cpp-type": "std::uint16_t"
    },
    "metrics_bind_address": {
      "type": "string",
      "x-env-override": "LI_ADMF_METRICS_BIND_ADDRESS",
      "x-cpp-type": "std::string"
    },
    "database_url": {
      "type": "string",
      "x-env-override": "LI_ADMF_DATABASE_URL",
      "x-cpp-type": "std::string",
      "x-sensitivity": "credential"
    },
    "db_pool_size": {
      "type": "integer",
      "x-env-override": "LI_ADMF_DB_POOL_SIZE",
      "x-cpp-type": "std::size_t"
    },
    "public_base_url": {
      "type": "string",
      "x-env-override": "LI_ADMF_PUBLIC_BASE_URL",
      "x-cpp-type": "std::string"
    },
    "endpoint_id": {
      "type": "object",
      "additionalProperties": false,
      "properties": {
        "country_code": {
          "type": "string"
        },
        "unique_identifier": {
          "type": "string"
        }
      }
    },
    "national_profile": {
      "type": "object",
      "additionalProperties": false,
      "properties": {
        "owner": {
          "type": "string"
        },
        "version": {
          "type": "string"
        }
      }
    },
    "supported_etsi_versions": {
      "type": "array",
      "items": {
        "type": "string"
      }
    },
    "lea_bindings": {
      "type": "array",
      "items": {
        "type": "object",
        "additionalProperties": false,
        "properties": {
          "peer_cert_cn": {
            "type": "string"
          },
          "country_code": {
            "type": "string"
          },
          "unique_identifier": {
            "type": "string"
          }
        }
      }
    }
  },
  "required": [
    "database_url",
    "db_pool_size",
    "hi1_port",
    "metrics_bind_address",
    "public_base_url"
  ],
  "x-config-file": "config/li-admf.json",
  "x-source": [
    "nfs/li-admf"
  ],
  "x-apply": "restart",
  "x-review": [
    "endpoint_id: nested object shape inferred from current values (map-vs-struct meaning unverified; new keys refused until reviewed)",
    "national_profile: nested object shape inferred from current values (map-vs-struct meaning unverified; new keys refused until reviewed)",
    "lea_bindings[]: nested object shape inferred from current values (map-vs-struct meaning unverified; new keys refused until reviewed)"
  ]
}
